{"prereqs":null,"dist":"Pod-Spell-CommonMistakes","via":"App::cpanminus::reporter 0.17 (1.7043)","grade":"PASS","distversion":"1.002","distname":"Pod-Spell-CommonMistakes-1.002","author":"APOCAL","test_output":"Building and testing Pod-Spell-CommonMistakes-1.002\ncp lib/Pod/Spell/CommonMistakes/WordList.pm blib/lib/Pod/Spell/CommonMistakes/WordList.pm\ncp lib/Pod/Spell/CommonMistakes.pm blib/lib/Pod/Spell/CommonMistakes.pm\nt/00-compile.t ......... ok\n# \n# Versions for all modules listed in MYMETA.json (including optional ones):\n# \n# === Configure Requires ===\n# \n#     Module               Want  Have\n#     ------------------- ----- -----\n#     ExtUtils::MakeMaker   any  7.34\n#     Module::Build::Tiny 0.039 0.039\n# \n# === Test Requires ===\n# \n#     Module              Want     Have\n#     ------------------- ---- --------\n#     ExtUtils::MakeMaker  any     7.34\n#     File::Spec           any     3.74\n#     File::Temp           any   0.2304\n#     IO::Handle           any     1.39\n#     IPC::Open3           any     1.20\n#     Test::More           any 1.302136\n# \n# === Test Recommends ===\n# \n#     Module         Want     Have\n#     ---------- -------- --------\n#     CPAN::Meta 2.120900 2.150010\n# \n# === Runtime Requires ===\n# \n#     Module      Want  Have\n#     ---------- ----- -----\n#     Exporter     any  5.73\n#     IO::Scalar 2.110 2.111\n#     Pod::Spell  1.01  1.20\n#     parent       any 0.236\n#     strict       any  1.11\n#     warnings     any  1.42\n# \nt/00-report-prereqs.t .. ok\nt/apocalypse.t ......... skipped: Test::Apocalypse required for validating the distribution\nAll tests successful.\nFiles=3, Tests=3,  0 wallclock secs ( 0.03 usr  0.01 sys +  0.30 cusr  0.10 csys =  0.44 CPU)\nResult: PASS\n"}
