{"grade":"PASS","distversion":"0.040001","via":"App::cpanminus::reporter 0.17 (1.7043)","dist":"MaxMind-DB-Common","prereqs":null,"distname":"MaxMind-DB-Common-0.040001","test_output":"Building and testing MaxMind-DB-Common-0.040001\ncp lib/Test/MaxMind/DB/Common/Data.pm blib/lib/Test/MaxMind/DB/Common/Data.pm\ncp lib/Test/MaxMind/DB/Common/Util.pm blib/lib/Test/MaxMind/DB/Common/Util.pm\ncp lib/MaxMind/DB/Types.pm blib/lib/MaxMind/DB/Types.pm\ncp lib/MaxMind/DB/Metadata.pm blib/lib/MaxMind/DB/Metadata.pm\ncp lib/MaxMind/DB/Role/Debugs.pm blib/lib/MaxMind/DB/Role/Debugs.pm\ncp lib/MaxMind/DB/Common.pm blib/lib/MaxMind/DB/Common.pm\nPERL_DL_NONLAZY=1 \"/usr/home/jkeenan/var/tad/testing/perl-5.29.0/bin/perl\" \"-MExtUtils::Command::MM\" \"-MTest::Harness\" \"-e\" \"undef *Test::Harness::Switches; test_harness(0, 'blib/lib', 'blib/arch')\" t/*.t t/MaxMind/DB/*.t\n# \n# Versions for all modules listed in MYMETA.json (including optional ones):\n# \n# === Configure Requires ===\n# \n#     Module              Want Have\n#     ------------------- ---- ----\n#     ExtUtils::MakeMaker  any 7.34\n# \n# === Build Requires ===\n# \n#     Module              Want Have\n#     ------------------- ---- ----\n#     ExtUtils::MakeMaker  any 7.34\n# \n# === Test Requires ===\n# \n#     Module              Want     Have\n#     ------------------- ---- --------\n#     ExtUtils::MakeMaker  any     7.34\n#     File::Spec           any     3.74\n#     Test::More          0.96 1.302136\n# \n# === Test Recommends ===\n# \n#     Module         Want     Have\n#     ---------- -------- --------\n#     CPAN::Meta 2.120900 2.150010\n# \n# === Runtime Requires ===\n# \n#     Module                  Want     Have\n#     ----------------------- ---- --------\n#     Carp                     any     1.50\n#     Data::Dumper::Concise    any    2.023\n#     DateTime                 any     1.49\n#     Exporter                 any     5.73\n#     List::AllUtils           any     0.14\n#     Math::BigInt             any 1.999813\n#     Moo                      any 2.003004\n#     Moo::Role                any 2.003004\n#     MooX::StrictConstructor  any    0.010\n#     Scalar::Util             any     1.50\n#     Sub::Quote               any 2.005001\n#     autodie                  any     2.29\n#     constant                 any     1.33\n#     namespace::autoclean     any     0.28\n#     overload                 any     1.30\n#     strict                   any     1.11\n#     warnings                 any     1.42\n# \nt/00-report-prereqs.t ..... ok\nt/author-00-compile.t ..... skipped: these tests are for testing by the author\nt/author-eol.t ............ skipped: these tests are for testing by the author\nt/author-no-tabs.t ........ skipped: these tests are for testing by the author\nt/author-pod-spell.t ...... skipped: these tests are for testing by the author\nt/author-pod-syntax.t ..... skipped: these tests are for testing by the author\nt/author-test-version.t ... skipped: these tests are for testing by the author\nt/compile.t ............... ok\nt/MaxMind/DB/Common.t ..... ok\nt/MaxMind/DB/Metadata.t ... ok\nt/release-cpan-changes.t .. skipped: these tests are for release candidate testing\nt/release-portability.t ... skipped: these tests are for release candidate testing\nt/release-synopsis.t ...... skipped: these tests are for release candidate testing\nt/release-tidyall.t ....... skipped: these tests are for release candidate testing\nAll tests successful.\nFiles=14, Tests=8,  1 wallclock secs ( 0.03 usr  0.04 sys +  0.91 cusr  0.27 csys =  1.26 CPU)\nResult: PASS\n","author":"MAXMIND"}
